<?xml version="1.0" encoding="UTF-8"?>
<!DOCTYPE recette SYSTEM "recette.dtd">

<recette>
	<nom>Œufs à la coque</nom>
	<portion>4</portion>
	<preparation value="1" unit="min"/>
	&cuisson;
	<ingredients>
		<i>
			<nom id="ing1">œufs</nom>
			<nbre>4</nbre>
		</i>
	</ingredients>
	&guide;
</recette>